{
    "grand_alliance": "chaos",
    "warband": "Blades of Khorne: Bloodbound",
    "bladeborn": false,
    "heroes_all": false,
    "subfactions": [
        {
            "runemark": "Garrek's Reavers",
            "bladeborn": true,
            "heroes_all": false
        },
        {
            "runemark": "Magore's Fiends",
            "bladeborn": true,
            "heroes_all": false
        },
        {
            "runemark": "Gorechosen of Dromm",
            "bladeborn": true,
            "heroes_all": false
        }
    ]
}