{
    "grand_alliance": "chaos",
    "warband": "Slaves to Darkness",
    "bladeborn": false,
    "heroes_all": false,
    "subfactions": [
        {
            "runemark": "Khagra's Ravagers",
            "bladeborn": true,
            "heroes_all": false
        },
        {
            "runemark": "Godsworn Hunt",
            "bladeborn": true,
            "heroes_all": false
        },
        {
            "runemark": "Gnarlspirit Pack",
            "bladeborn": true,
            "heroes_all": false
        }
    ]
}