{
    "grand_alliance": "order",
    "warband": "Stormcast Eternals Sacrosanct Chamber",
    "bladeborn": false,
    "heroes_all": false,
    "subfactions": [
        {
            "runemark": "Stormsire's Cursebreakers",
            "bladeborn": true,
            "heroes_all": false
        }
    ]
}