{
    "grand_alliance": "death",
    "warband": "Nighthaunt",
    "bladeborn": false,
    "heroes_all": false,
    "subfactions": [
        {
            "runemark": "The Headsmen's Curse",
            "bladeborn": true,
            "heroes_all": false
        },
        {
            "runemark": "Thorns of the Briar Queen",
            "bladeborn": true,
            "heroes_all": false
        }
    ]
}