{
    "grand_alliance": "order",
    "warband": "Stormcast Eternals Vanguard Auxiliary Chamber",
    "bladeborn": false,
    "heroes_all": false,
    "subfactions": [
        {
            "runemark": "The Farstriders",
            "bladeborn": true,
            "heroes_all": false
        },
        {
            "runemark": "The Emberwatch",
            "bladeborn": true,
            "heroes_all": true
        }
    ]
}
