{
    "grand_alliance": "death",
    "warband": "Soulblight Gravelords",
    "bladeborn": false,
    "heroes_all": false,
    "subfactions": [
        {
            "runemark": "Sons of Velmorn",
            "bladeborn": true,
            "heroes_all": false
        },
        {
            "runemark": "The Crimson Court",
            "bladeborn": true,
            "heroes_all": false
        },
        {
            "runemark": "The Exiled Dead",
            "bladeborn": true,
            "heroes_all": false
        },
        {
            "runemark": "The Sepulchral Guard",
            "bladeborn": true,
            "heroes_all": false
        },
        {
            "runemark": "Zondara's Gravebreakers",
            "bladeborn": true,
            "heroes_all": false
        },
        {
            "runemark": "The Blades of the Hollow King",
            "bladeborn": true,
            "heroes_all": true
        }
    ]
}
