{
    "grand_alliance": "destruction",
    "warband": "Ogor Mawtribes",
    "bladeborn": false,
    "heroes_all": false,
    "subfactions": [
        {
            "runemark": "Blackpowder's Buccaneers",
            "bladeborn": true,
            "heroes_all": false
        },
        {
            "runemark": "Hrothgorn's Mantrappers",
            "bladeborn": true,
            "heroes_all": false
        }
    ]
}