{
    "grand_alliance": "destruction",
    "warband": "Gloomspite Gitz",
    "bladeborn": false,
    "heroes_all": false,
    "subfactions": [
        {
            "runemark": "Zarbag's Gitz",
            "bladeborn": true,
            "heroes_all": false
        },
        {
            "runemark": "Grinkrak's Looncourt",
            "bladeborn": true,
            "heroes_all": false
        },
        {
            "runemark": "Mollog's Mob",
            "bladeborn": true,
            "heroes_all": false
        },
        {
            "runemark": "Rippa's Snarlfangs",
            "bladeborn": true,
            "heroes_all": false
        },
        {
            "runemark": "Borgit's Beastgrabbaz",
            "bladeborn": true,
            "heroes_all": true
        }
    ]
}
