{
    "grand_alliance": "destruction",
    "warband": "Kruleboyz",
    "bladeborn": false,
    "heroes_all": false,
    "subfactions": [
        {
            "runemark": "Daggok's Stab-ladz",
            "bladeborn": true,
            "heroes_all": false
        },
        {
            "runemark": "Da Kunnin' Krew",
            "bladeborn": true,
            "heroes_all": false
        }
    ]
}