{
    "grand_alliance": "order",
    "warband": "Stormcast Eternals Thunderstrike Stormcast",
    "bladeborn": false,
    "heroes_all": false,
    "subfactions": [
        {
            "runemark": "Xandire's Truthseekers",
            "bladeborn": true,
            "heroes_all": false
        },
        {
            "runemark": "Domitan's Stormcoven",
            "bladeborn": true,
            "heroes_all": false
        },
        {
            "runemark": "Gladitorium",
            "bladeborn": false,
            "heroes_all": true
        }
    ]
}