{
    "grand_alliance": "order",
    "warband": "Seraphon",
    "bladeborn": false,
    "heroes_all": false,
    "subfactions": [
        {
            "runemark": "The Starblood Stalkers",
            "bladeborn": true,
            "heroes_all": false
        },
        {
            "runemark": "Jaws of Itzl",
            "bladeborn": true,
            "heroes_all": true
        }
    ]
}
